{
  "task": "survival-recovery",
  "method": "Kaplan-Meier survival (handles censoring) vs naive proportion that treats censored as failures",
  "n": 160,
  "true_surv_treat": 0.65,
  "true_surv_control": 0.3,
  "km_surv_treat": 0.651,
  "km_surv_control": 0.2986,
  "naive_surv_treat": 0.525,
  "naive_surv_control": 0.2375
}
